"Código da Unidade Orçamentária","Unidade Orçamentária","Código da Unidade Gestora","Unidade Gestora","EXECUTADA (R$)","REALIZADA (R$)","SALDO A PAGAR (R$)"
"10101","SEC DE ESTADO DA MULHER E DA DIVERSIDADE HUMANA","100001","SEC ESPECIAL DE ESTADO DE POLITICAS PUB PARA MULHERES","1939218.94","1923019.72","16199.22"
"1101","ASSEMBLEIA LEGISLATIVA","10001","ASSEMBLEIA LEGISLATIVA","200900933.75","199312910.77","1588022.98"
"11101","CONTROLADORIA GERAL DO ESTADO","110001","GABINETE DO SECRETARIO","16204657.05","15990910.10","213746.95"
"12101","SEC. DE ESTADO DO DES. E DA ARTICULACAO MUNICIPAL","120001","GABINETE DO SECRETARIO","993347.45","986193.91","7153.54"
"13101","PROCURADORIA GERAL DO ESTADO","130001","PROCURADORIA GERAL DO ESTADO","19856533.89","19754165.27","102368.62"
"13901","FUNDO DE MODERNIZACAO E REAPAR DA PROC GERAL DO ESTADO","740001","FUNDO DE MODERNIZACAO E REAPAR DA PROC GERAL DO ESTADO","140502.64","136032.63","4470.01"
"14101","DEFENSORIA PUBLICA DO ESTADO DA PARAIBA","140001","DEFENSORIA PUBLICA DO ESTADO DA PARAIBA","47127444.83","47009567.58","117877.25"
"14901","FUNDO ESTADUAL DE DEFESA DOS DIREITOS DO CONSUMIDOR","560001","FUNDO ESTADUAL DE DEFESA DOS DIREITOS DO CONSUMIDOR","705803.80","665884.27","39919.53"
"14902","FUNDO ESPECIAL DA DEFENSORIA PUBLICA","600001","FUNDO ESPECIAL DE DEFENSORIA PUBLICA","20000.00","7350.00","12650.00"
"15101","POLICIA MILITAR DO ESTADO","150001","COMANDO GERAL DA POLICIA MILITAR","454206874.27","450051745.49","4155128.78"
"15101","SUP. DE OBRAS DO PLANO DE DESENVOLVIMENTO DO ESTADO","340201","COMANDO GERAL DA POLICIA MILITAR","80951.22","80951.22","0.00"
"15201","HOSPITAL DA POLICIA MILITAR GEN EDSON RAMALHO","150101","INSTITUTO HOSPITALAR GENERAL EDSON RAMALHO","20120714.20","19034663.87","1086050.33"
"17101","SECRETARIA DE ESTADO DA RECEITA","170001","GABINETE DO SECRETARIO","167739742.77","166274202.74","1465540.03"
"17102","SECRETARIA DE ESTADO DA RECEITA","170001","UNIDADE SETORIAL DE ADMINISTRACAO","283901.20","258308.70","25592.50"
"17103","SECRETARIA DE ESTADO DA RECEITA","170001","GERENCIA DE PROGRAMACAO ORCAMENTARIA ESTADUAL","72109.05","65241.05","6868.00"
"17104","SECRETARIA DE ESTADO DA RECEITA","170001","GERENCIA DO NUCLEO CENTRAL DE INFORMATICA","53722.30","49776.66","3945.64"
"17902","FUNDO DE APOIO AO DESENV. DA ADMINISTRACAO TRIBUTARIA","730001","FUNDO DE APOIO AO DESENVOLV.DA ADMINISTRACAO TRIBUTARIA","1306243.99","773734.87","532509.12"
"18101","SECRETAR DE ESTADO DA INTERIORIZACAO DA ACAO DO GOVERNO","180001","GABINETE DO SECRETARIO","1785484.85","1770663.22","14821.63"
"19101","SECRETARIA DE ESTADO DA ADMINISTRACAO","190001","GABINETE DO SECRETARIO","20916604.82","20001256.16","915348.66"
"19201","INSTITUTO DE ASSISTENCIA A SAUDE DO SERVIDOR","190101","INSTITUTO DE ASSISTENCIA A SAUDE DO SERVIDOR - IPEP","28921687.62","28237381.80","684305.82"
"19202","ESPEP - ESCOLA DE SERVICO PUBLICO DO ESTADO DA PARAIBA","190201","ESCOLA DE SERVICO PUBLICO DO ESTADO DA PARAIBA - ESPEP","1439009.72","1148167.73","290841.99"
"19204","CODATA - CIA DE PROCESSAMENTO DE DADOS DA PARAIBA","190401","COMPANHIA DE PROCESSAMENTO DE DADOS DA PARAIBA - CODATA","23586805.80","19629330.76","3957475.04"
"19901","FUNDO ESPECIAL DE DESENV DE RECURSOS HUMANOS","490001","FUNDO ESPECIAL DE DESENVOLVIMENTO DE RECURSOS HUMANOS","3012485.56","2721589.17","290896.39"
"20101","SECRETARIA DE ESTADO DAS FINANCAS","200001","SECRETARIA EXECUTIVA DA FAZENDA","6191467.42","6161658.07","29809.35"
"20102","SECRETARIA DE ESTADO DAS FINANCAS","200001","SECRETATRIA EXECUTIVA DA RECEITA","56790178.79","56790178.79","0.00"
"20103","SECRETARIA DE ESTADO DAS FINANCAS","200001","PRIMEIRA GERÊNCIA REGIONAL","18000.00","18000.00","0.00"
"20104","SECRETARIA DE ESTADO DAS FINANCAS","200001","SEGUNDA GERÊNCIA REGIONAL","18150.00","18150.00","0.00"
"20105","SECRETARIA DE ESTADO DAS FINANCAS","200001","TERCEIRA GERÊNCIA REGIONAL","18600.00","18575.00","25.00"
"20106","SECRETARIA DE ESTADO DAS FINANCAS","200001","QUARTA GERÊNCIA REGIONAL","9215.00","9215.00","0.00"
"20107","SECRETARIA DE ESTADO DAS FINANCAS","200001","QUINTA GERÊNCIA REGIONAL","10243.50","10243.50","0.00"
"20108","SECRETARIA DE ESTADO DAS FINANCAS","200001","ESCOLA DE ADMINISTRAÇÃO TRIBUTÁRIA","63658.06","63658.06","0.00"
"20902","FUNDO DE APOIO AO DESENV. DA ADMINISTRACAO TRIBUTARIA","790001","FUNDO DE APOIO AO DESENVOLV.DA ADMINISTRAÇÃO TRIBUTÁRIA","0.00","0.00","0.00"
"2101","TRIBUNAL DE CONTAS","20001","TRIBUNAL DE CONTAS","97568918.63","93121638.47","4447280.16"
"21101","SEC DE ESTADO DO TURISMO E DO DESENVOLVIMENTO ECONOMICO","210001","GABINETE DO SECRETARIO","11517237.98","11165951.03","351286.95"
"21201","CIA DE DESENVOLVIMENTO DA PARAIBA","210101","COMPANHIA DE INDUSTRIALIZACAO DO ESTADO DA PARAIBA","18726739.03","18482243.64","244495.39"
"21202","EMPRESA PARAIBANA DE TURISMO SA  -  PB-TUR","210201","EMPRESA PARAIBANA DE TURISMO - PB/TUR","4241950.03","4134915.64","107034.39"
"21204","INSTITUTO DE METROLOGIA E QUALIDADE INDUST. DA PARAIBA","210401","INSTITUTO DE METROLOGIA E QUALIDADE INDUST DA PB IMEQ","5054332.91","5049154.75","5178.16"
"21205","JUNTA COMERCIAL DO ESTADO DA PARAIBA","210501","JUNTA COMERCIAL DO ESTADO DA PARAIBA","5172488.97","4738140.50","434348.47"
"21205","SUP. DE OBRAS DO PLANO DE DESENVOLVIMENTO DO ESTADO","340201","JUNTA COMERCIAL DO ESTADO DA PARAIBA","77098.09","77098.09","0.00"
"21207","PB-TUR HOTEIS S/A","210701","PB-TUR HOTEIS S/A","430400.26","422934.84","7465.42"
"21212","CIA DE DESENVOLVIMENTO DE RECURSOS MINERAIS DA PARAIBA","211201","CIA DE DESENVOLVIMENTO DE RECURSOS MINERAIS - CDRM","5484377.97","5401209.27","83168.70"
"21901","FUNDO ESTADUAL DE APOIO AO EMPREENDEDORISMO","770001","FUNDO ESTADUAL DE APOIO AO EMPREENDEDORISMO","19771589.34","19771589.34","0.00"
"21902","FUNDO DE APOIO AO DESENVOLVIMENTO INDUSTRIAL DA PB","650001","FUNDO DE APOIO AO DESENVOLVIMENTO INDUSTRIAL DA PARAíBA","2381534.32","1768799.26","612735.06"
"22101","SECRETARIA DE ESTADO DA EDUCACAO","220001","GABINETE DO SECRETARIO","1010797683.61","817246311.41","193551372.20"
"22101","SUP. DE OBRAS DO PLANO DE DESENVOLVIMENTO DO ESTADO","340201","GABINETE DO SECRETARIO","23152947.42","7969652.55","15183294.87"
"22101","UNIVERSIDADE ESTADUAL DA PARAIBA","220401","GABINETE DO SECRETARIO","0.00","0.00","0.00"
"22101","FUNDACAO CENTRO INTEGR. DE APOIO AO POR. DE DEFICIENCIA","220801","GABINETE DO SECRETARIO","39774.96","39774.96","0.00"
"22102","SECRETARIA DE ESTADO DA EDUCACAO","220001","SUBSECRETARIA DE CULTURA","118782.55","112458.80","6323.75"
"22103","SECRETARIA DE ESTADO DA EDUCACAO","220001","COORDENADORIA DE EDUCACAO BASICA","50164.16","50164.16","0.00"
"22104","SECRETARIA DE ESTADO DA EDUCACAO","220001","COORDENADORIA DE EDUCACAO DE JOVENS E ADULTOS","114941.90","114204.40","737.50"
"22105","SECRETARIA DE ESTADO DA EDUCACAO","220001","COORDENADORIA DE ENSINO MEDIO","57140.69","57140.69","0.00"
"22106","SECRETARIA DE ESTADO DA EDUCACAO","220001","COORDENADORIA DE ASSISTENCIA AO EDUCANDO","101382.40","100622.40","760.00"
"22108","SECRETARIA DE ESTADO DA EDUCACAO","220001","COORDENADORIA DE EDUCACAO FISICA E DESPORTOS","102978.86","102351.66","627.20"
"22109","SECRETARIA DE ESTADO DA EDUCACAO","220001","COORDENADORIA DA EDUCACAO PROFISSIONAL","67025.00","65625.00","1400.00"
"22110","SECRETARIA DE ESTADO DA EDUCACAO","220001","SUBSECRETARIA DE EDUCACAO","140685.60","138585.60","2100.00"
"22204","UNIVERSIDADE ESTADUAL DA PARAIBA","220401","UNIVERSIDADE ESTADUAL DA PARAIBA - UEPB","248901164.68","227589647.20","21311517.48"
"22205","FUNDACAO CASA DO ESTUDANTE DA PARAIBA","220501","FUNDACAO CASA DO ESTUDANTE DA PARAIBA","213338.79","211368.83","1969.96"
"22208","SUP. DE OBRAS DO PLANO DE DESENVOLVIMENTO DO ESTADO","340201","FUNDACAO CENTRO INTEG DE APOIO AO PORTADOR DE DEF FUNAD","94363.86","94363.86","0.00"
"22208","FUNDACAO CENTRO INTEGR. DE APOIO AO POR. DE DEFICIENCIA","220801","FUNDACAO CENTRO INTEG DE APOIO AO PORTADOR DE DEF FUNAD","6032199.82","5735302.87","296896.95"
"23101","CORPO DE BOMBEIROS MILITAR","230001","CORPO DE BOMBEIROS MILITAR","63165016.91","63018208.11","146808.80"
"23901","FUNDO ESPECIAL DO CORPO DE BOMBEIROS","570001","FUNDO ESPECIAL DO CORPO DE BOMBEIROS","5591700.13","4233301.11","1358399.02"
"24101","SECRETARIA DE ESTADO DA ADMINISTRACAO PENITENCIARIA","240001","GABINETE DO SECRETARIO","96962005.28","88991787.47","7970217.81"
"25101","SUP. DE OBRAS DO PLANO DE DESENVOLVIMENTO DO ESTADO","340201","GABINETE DO SECRETARIO / FESEP","11740247.80","11740247.80","0.00"
"25101","SECRETARIA DE ESTADO DA SAUDE","250001","GABINETE DO SECRETARIO / FESEP","892771530.53","832551407.66","60220122.87"
"25102","SECRETARIA DE ESTADO DA SAUDE","250001","CONSELHO ESTADUAL DE SAUDE","796266.39","740916.34","55350.05"
"25201","LABORATORIO INDUSTRIAL FARMACEUTICO DA PARAIBA S/A","250101","LABORATORIO INDUSTRIAL FARMACEUTICO DA PARAIBA S/A","410230.95","393865.71","16365.24"
"25202","AGENCIA ESTADUAL DE VIGILANCIA SANITARIA","250201","AGENCIA ESTADUAL DE VIGILANCIA SANITARIA - AGEVISA","2906212.60","2876078.80","30133.80"
"26101","SECRETARIA DE ESTADO DA SEGURANCA E DA DEFESA SOCIAL","260001","GABINETE DO SECRETARIO","174719647.65","172368767.63","2350880.02"
"26102","SECRETARIA DE ESTADO DA SEGURANCA E DA DEFESA SOCIAL","260001","SUPERINTENDENCIA GERAL DE POLICIA CIVIL","1071867.50","992058.92","79808.58"
"26102","SUP. DE OBRAS DO PLANO DE DESENVOLVIMENTO DO ESTADO","340201","SUPERINTENDENCIA GERAL DE POLICIA CIVIL","239819.73","239819.73","0.00"
"26201","SUP. DE OBRAS DO PLANO DE DESENVOLVIMENTO DO ESTADO","340201","DEPARTAMENTO ESTADUAL DE TRANSITO DETRAN","105690.69","105690.69","0.00"
"26201","DEPARTAMENTO ESTADUAL DE TRANSITO","260101","DEPARTAMENTO ESTADUAL DE TRANSITO DETRAN","108554106.10","104930370.42","3623735.68"
"26901","FUNDO ESPECIAL DA SEGURANCA PUBLICA","460001","FUNDO ESPECIAL DE SEGURANCA PUBLICA - FESP","2860718.41","808757.24","2051961.17"
"27101","COMPANHIA ESTADUAL DE HABITACAO POPULAR","270401","GABINETE DO SECRETARIO","18643043.62","18269915.41","373128.21"
"27101","SECRETARIA DE ESTADO DO DESENVOLVIMENTO HUMANO","270001","GABINETE DO SECRETARIO","46390645.34","34844712.63","11545932.71"
"27201","FUND DESENV CRIANCA E ADOLESCENTE ALICE ALMEIDA","270101","FUNDACAO DESENV DA CRIANCA E DO ADOLES ALICE DE ALMEIDA","30184612.23","28974621.23","1209991.00"
"27202","FUNDACAO DE ACAO COMUNITARIA","270201","FUNDACAO DE ACAO COMUNITARIA","57437171.54","52620416.67","4816754.87"
"27203","LOTERIA DO ESTADO DA PARAIBA","270301","LOTERIA DO ESTADO DA PARAIBA - LOTEP","957928.98","916765.44","41163.54"
"27204","COMPANHIA ESTADUAL DE HABITACAO POPULAR","270401","COMPANHIA ESTADUAL DE HABITACAO POPULAR CEHAP","24459870.56","24085795.37","374075.19"
"27901","FUNDO ESTADUAL DA CRIANCA E DO ADOLESCENTE","480001","FUNDO ESTADUAL DA CRIANCA E DO ADOLESCENTE","760483.04","609292.04","151191.00"
"27901","FUND DESENV CRIANCA E ADOLESCENTE ALICE ALMEIDA","270101","FUNDO ESTADUAL DA CRIANCA E DO ADOLESCENTE","14996.00","14996.00","0.00"
"27902","FUND DESENV CRIANCA E ADOLESCENTE ALICE ALMEIDA","270101","FUNDO ESTADUAL DE ASSISTENCIA SOCIAL - FEAS","29999.02","29999.02","0.00"
"27902","FUNDO ESTADUAL DE ASSISTENCIA SOCIAL","500001","FUNDO ESTADUAL DE ASSISTENCIA SOCIAL - FEAS","4710298.61","4307386.03","402912.58"
"27903","FUNDO ESTADUAL DE HAB E REG FUNDIARIA DE INTER SOCIAL","710001","FUNDO ESTADUAL DE HAB E REGUL FUNDIARIA DE INTER GERAL","137500.00","137500.00","0.00"
"28101","DEPARTAMENTO DE ESTRADAS E RODAGEM","340101","GABINETE DO SECRETARIO","2100131.15","2100131.15","0.00"
"28101","SEC DE EST DO MEIO AMB DOS REC HID DA CIEN E TECNOLOGIA","280001","GABINETE DO SECRETARIO","29353551.30","29316613.24","36938.06"
"28201","SUPERINTENDENCIA DE ADMINISTRACAO DO MEIO AMBIENTE","280101","SUPERINTENDENCIA DE ADMINISTRACAO DO MEIO AMBIENTE","10064229.45","9419124.17","645105.28"
"28204","FUNDACAO DE APOIO A PESQUISA DO ESTADO DA PB - FAPESQ","280401","FUNDACAO DE APOIO A PESQUISA DO ESTADO DA PARAIBA","7633946.94","4488102.22","3145844.72"
"28205","AGENCIA EXECUTIVA DE GESTAO DAS AGUAS DO ESTADO DA PB","280501","AGENCIA EXECUTIVA DE GESTAO DAS AGUAS DO ESTADO DA PB","2331560.97","2298767.70","32793.27"
"28901","FUNDO ESTADUAL DE PROTECAO AO MEIO AMBIENTE","590001","FUNDO ESTADUAL DE PROTECAO AO MEIO AMBIENTE","42786.02","32287.02","10499.00"
"28902","FUNDO ESTADUAL DE RECURSOS HIDRICOS","610001","FUNDO ESTADUAL DE RECURSOS HIDRICOS","97827.89","97827.89","0.00"
"2901","FUNDO DE FISCALIZACAO ORCAMENTARIA E FINANC MUNICIPAL","630001","FUNDO DE FISCALIZACAO ORCAMENTARIA E FINANCEIRA MUNICIP","196000.00","196000.00","0.00"
"29101","SECRETARIA DE ESTADO DA COMUNICACAO INSTITUCIONAL","290001","GABINETE DO SECRETARIO","45940398.95","43814865.25","2125533.70"
"29202","A UNIAO - SUP. DE IMPRENSA E EDITORA","290201","A UNIAO SUPERINTENDENCIA DE IMPRENSA E EDITORA","9420319.04","8492660.07","927658.97"
"29203","RADIO TABAJARA - SUPERINTENDENCIA DE RADIODIFUSAO","290301","RADIO TABAJARA - SUPERINTENDENCIA DE RADIODIFUSAO","3464825.06","3320384.14","144440.92"
"30101","ENCARGOS GERAIS DO ESTADO - SUP SEC ADMINISTRACAO","300001","RECURSOS SOB SUPERVISAO DA SECRETARIA DA ADMINISTRACAO","147530553.68","133819176.48","13711377.20"
"30102","ENCARGOS GERAIS DO ESTADO - SUP FINANCAS","300002","RECURSOS SOB SUPERVISAO DA SEC DE ESTADO DAS FINANCAS","517584886.81","514856792.64","2728094.17"
"32101","SECRETARIA DE ESTADO DO PLANEJAMENTO E GESTAO","320001","GABINETE DO SECRETáRIO","17272803.71","16992613.53","280190.18"
"32102","SECRETARIA DE ESTADO DO PLANEJAMENTO E GESTAO","320001","PROGRAMA ESTADUAL ORIENTCAO PROTECAO COMSUMIDOR","823191.00","823191.00","0.00"
"32201","IDEME - INST DE DESENV MUNICIPAL E ESTADUAL","320101","INSTITUTO DE DESENVOLVIMENTO MUNICIPAL E ESTADUAL IDEME","477586.31","477586.31","0.00"
"32901","FUNDO DE COMBATE E ERRADICACAO DA POBREZA NO ESTADO PB","670001","FUND DE COMBATE E ERRADICAÇÃO DA POBR NO EST DA PARAÍBA","10996833.32","8675926.42","2320906.90"
"32902","FUNDO DE DESENVOLVIMENTO DO ESTADO DA PARAIBA","750001","FUNDO DE DESENVOLVIMENTO DO ESTADO DA PARAIBA","1298637.86","1298637.86","0.00"
"33101","PROJETO COOPERAR DO ESTADO DA PARAIBA","330001","PROJETO NORDESTE","35603375.29","32847450.57","2755924.72"
"34101","SECRETARIA DE ESTADO DA INFRA-ESTRUTURA","340001","GABINETE DO SECRETARIO","73981273.30","72761398.05","1219875.25"
"34102","SECRETARIA DE ESTADO DA INFRA-ESTRUTURA","340001","COMISSAO DE DEFESA CIVIL DO ESTADO DA PARAIBA","19795602.44","18200628.19","1594974.25"
"34103","SECRETARIA DE ESTADO DA INFRA-ESTRUTURA","340001","UNIDADE EXECUTIVA LOCAL - PAC NA PARAIBA","26022188.63","23455464.91","2566723.72"
"34201","DEPARTAMENTO DE ESTRADAS E RODAGEM","340101","DEPARTAMENTO DE ESTRADAS DE RODAGEM - DER","225166555.64","215961977.97","9204577.67"
"34202","SUP. DE OBRAS DO PLANO DE DESENVOLVIMENTO DO ESTADO","340201","SUPERINTENDENCIA DE OBRAS DO PLANO DE DESENV DO ESTADO","97699221.97","96178239.35","1520982.62"
"34203","COMPANHIA DOCAS DA PARAIBA","340301","COMPANHIA DOCAS DA PARAIBA","12322823.87","11647872.51","674951.36"
"34206","COMPANHIA DE AGUA E ESGOTOS DO ESTADO DA PARAIBA","340601","COMPANHIA DE AGUA E ESGOTOS DO ESTADO DA PARAIBA CAGEPA","27252574.78","25079488.57","2173086.21"
"35101","SEC DE ESTADO DO DESENV DA AGROPECUARIA E DA PESCA","350001","GABINETE DO SECRETÁRIO","28698899.55","28650678.13","48221.42"
"35201","EMATER - EMP. DE ASSISTENCIA TECNICA E EXTENCAO RURAL","350101","EMPRESA DE ASSISTENCIA TECNICA E EXTENSAO RURAL DA PB","93301559.20","91429972.28","1871586.92"
"35202","EMEPA - EMP. ESTADUAL DE PESQUISA AGRO. DA PARAIBA","350201","EMPRESA ESTADUAL DE PESQUISA AGROPECUARIA DA PARAIBA","20902985.65","18950088.30","1952897.35"
"35203","INTERPA - INS. DE TERRAS E PLAN. AGRI. EST. DA PARAIBA","350301","INSTITUTO DE TERRAS E PLANEJ AGRIC DO EST DA PARAIBA","10399693.37","9895262.72","504430.65"
"35204","EMPASA - EMP. PARAIBANA DE ABAST. E SERV. AGRICOLAS","350401","EMPRESA PARAIBANA DE ABASTECIMENTO E SERV AGRICOLAS PB","25228578.95","24462946.55","765632.40"
"35901","FUNDO DE DESENVOLVIMENTO AGROPECUARIO DO ESTADO DA PB","680001","FUNDO DE DESENV AGROPECUARIO DO ESTADO DA PARAíBA","17581825.18","12340334.92","5241490.26"
"36101","SECRETARIA DE ESTADO DA EDUCACAO","220001","GABINETE DO SECRETARIO","600000.00","600000.00","0.00"
"36101","SECRETARIA DE ESTADO DA CULTURA","360001","GABINETE DO SECRETARIO","3674175.63","3406751.28","267424.35"
"36201","FUNDACAO ESPACO CULTURAL DA PARAIBA","360101","FUNDACAO ESPACO CULTURAL DO ESTADO DA PARAIBA","5542922.96","5358305.97","184616.99"
"36203","FUNDACAO CASA DE JOSE AMERICO","360301","FUNDACAO CASA DE JOSE AMERICO","692590.96","676332.13","16258.83"
"36206","FUNDACAO ERNANI SATYRO","360601","FUNDACAO ERNANI SATYRO","446752.72","439777.72","6975.00"
"36209","INST. DE PATRIMONIO HISTORICO E ART. DO EST. DA PARAIBA","360901","INSTIT. DO PATRIMONIO HIST. E ARTIST. DO E.PB","73526.58","65449.46","8077.12"
"36902","FUNDO DE INCENTIVO A CULTURA AUGUSTO DOS ANJOS","760001","FUNDO DE INCENTIVO A CULTURA AUGUSTO DOS ANJOS","348191.12","7978.12","340213.00"
"5101","JUSTICA COMUM","50001","JUSTICA COMUM","401094537.54","394451735.63","6642801.91"
"5101","PARAIBA PREVIDENCIA - PBPREV","90101","JUSTICA COMUM","4233638.73","4233638.73","0.00"
"5102","JUSTICA COMUM","50001","ENCARGOS JUDICIARIOS","93803694.19","93803694.19","0.00"
"5901","FUNDO ESPECIAL DO PODER JUDICIARIO","530001","FUNDO ESPECIAL DO PODER JUDICIARIO","28123217.01","22332315.05","5790901.96"
"5901","JUSTICA COMUM","50001","FUNDO ESPECIAL DO PODER JUDICIARIO","32875448.83","32875448.83","0.00"
"6101","PARAIBA PREVIDENCIA - PBPREV","90101","MINISTERIO PUBLICO","1832444.83","1832444.83","0.00"
"6101","MINISTERIO PUBLICO","60001","MINISTERIO PUBLICO","166558092.71","159235718.22","7322374.49"
"7101","SECRETARIA DE ESTADO DA JUVENTUDE, ESPORTE E LAZER","70001","GABINETE DO SECRETARIO","4269152.15","4037921.61","231230.54"
"9101","CASA CIVIL DO GOVERNADOR","90001","CASA CIVIL DO GOVERNADOR","15438866.20","15322355.48","116510.72"
"9102","GABINETE VICE GOVERNADOR","90002","GABINETE DO VICE-GOVERNADOR","2072998.95","2054589.25","18409.70"
"9103","CASA MILITAR","90003","CASA MILITAR","18194137.78","18124879.80","69257.98"
"9104","ESCRITORIO DE REP. INSTITUCIONAL DO ESTADO DA PARAIBA","90004","ESCRITORIO DE REP. INSTITUCIONAL DO ESTADO DA PARAIBA","458407.47","455301.93","3105.54"
"9201","PARAIBA PREVIDENCIA - PBPREV","90101","PARAIBA PREVIDENCIA - PBPREV","1307669015.17","1307551007.27","118007.90"
"9202","AGENCIA DE REGULACAO DO ESTADO DA PARAIBA","90201","AGENCIA DE REGULACAO DO ESTADO DA PARAIBA","2453383.88","2355074.89","98308.99"