"28","ENCARGOS ESPECIAIS","590001","FUNDO ESTADUAL DE PROTECAO AO MEIO AMBIENTE","856.57","856.57","0.00"
"28","ENCARGOS ESPECIAIS","290001","SECRETARIA DE ESTADO DA COMUNICACAO INSTITUCIONAL","29120.00","29120.00","0.00"
"28","ENCARGOS ESPECIAIS","300001","RECURSOS SOB SUP DA SEC DE ESTADO DA ADMINISTRACAO","23433536.19","5494014.98","17939521.21"
"28","ENCARGOS ESPECIAIS","300002","RECURSOS SOB SUPERVISAO DA SEC DE ESTADO DAS FINANCAS","314221444.72","313363100.84","858343.88"
"28","ENCARGOS ESPECIAIS","320001","SECRETARIA DE ESTADO DO PLANEJAMENTO E GESTAO","390.00","390.00","0.00"
"28","ENCARGOS ESPECIAIS","340001","SECRETARIA DE ESTADO DA INFRAESTRUTURA","28168279.84","28168279.84","0.00"
"28","ENCARGOS ESPECIAIS","340101","DEPARTAMENTO DE ESTRADAS DE RODAGEM","2095591.45","1774958.43","320633.02"
"28","ENCARGOS ESPECIAIS","350101","EMPRESA DE ASSISTENCIA TECNICA E EXTENSAO RURAL DA PB","211447.27","211447.27","0.00"
"28","ENCARGOS ESPECIAIS","350301","INSTITUTO DE TERRAS E PLANEJ AGRIC DO EST DA PARAIBA","10227.90","10227.90","0.00"
"28","ENCARGOS ESPECIAIS","680001","FUNDO DE DESENV AGROPECUARIO DO ESTADO DA PARAíBA","8341024.50","8341024.50","0.00"
"28","ENCARGOS ESPECIAIS","50001","JUSTICA COMUM","10502126.98","10493417.03","8709.95"
"28","ENCARGOS ESPECIAIS","530001","FUNDO ESPECIAL DO PODER JUDICIARIO","489480.36","486857.02","2623.34"